{
  "$schema": "https://json-schema.org/draft/2020-12/schema",
  "$id": "https://alpha.school/playbook/check-bundle.schema.json",
  "title": "Alpha Website Playbook check bundle",
  "description": "The compiled, hashed check bundle the production observer loads and the ticket filer applies (spec/check-bundle.generated.json, built by tests/build-checks.mjs from spec/check-rows.json). Row field names are the contract shared by the playbook, the observer (superbuilders/aeo alpha-site-system) and agent/file-observer-findings.mjs; do not rename them.",
  "type": "object",
  "required": ["version", "builtAt", "playbookCommit", "policySha256", "rowsSha256", "sha256", "pageFamilies", "sourceHealth", "rows", "retired"],
  "properties": {
    "$comment": { "type": "string" },
    "version": { "type": "string", "description": "Bundle contract version (spec/check-rows.json version)." },
    "builtAt": { "type": "string", "description": "ISO timestamp of the build; not part of the hash." },
    "playbookCommit": { "type": ["string", "null"], "description": "git HEAD when built; not part of the hash." },
    "policySha256": { "type": "string", "pattern": "^[0-9a-f]{64}$", "description": "policySha256 of spec/policy-bundle.generated.json the rows were compiled against." },
    "rowsSha256": { "type": "string", "pattern": "^[0-9a-f]{64}$", "description": "sha256 of JSON.stringify(rows)." },
    "sha256": { "type": "string", "pattern": "^[0-9a-f]{64}$", "description": "sha256 of the bundle without builtAt and playbookCommit; spec/release-manifest.json checkBundleSha256 carries it." },
    "observerInventory": {
      "type": "object",
      "description": "Where the observer check names came from (registry/observer-checks.json capturedFrom).",
      "properties": {
        "version": { "type": "string" },
        "commit": { "type": ["string", "null"] },
        "count": { "type": "number" }
      }
    },
    "pageFamilies": {
      "type": "object",
      "description": "Every value a row's pageFamily may take: real families from spec/page-family-requirements.json map to themselves; pseudo-families map to the families or routes they group.",
      "additionalProperties": true
    },
    "sourceHealth": {
      "type": "object",
      "description": "Source ids rows depend on, with the observer provider entity that reports their health and the registry/sources.json entry.",
      "additionalProperties": {
        "type": "object",
        "required": ["providerEntity", "registryKey"],
        "properties": {
          "providerEntity": { "type": ["string", "null"] },
          "registryKey": { "type": ["string", "null"] },
          "staleAfterHours": { "type": "number" },
          "note": { "type": "string" }
        }
      }
    },
    "rows": {
      "type": "array",
      "minItems": 1,
      "items": { "$ref": "#/$defs/row" }
    },
    "retired": {
      "type": "array",
      "items": { "$ref": "#/$defs/retired" }
    }
  },
  "$defs": {
    "row": {
      "type": "object",
      "required": ["id", "observerCheck", "title", "pageFamily", "lifecycleStates", "element", "expected", "comparator", "severity", "status", "channel", "ticketClass", "ownerRole", "dedupeScope", "clearAfterRuns", "gracePeriodHours", "requireConsecutiveRuns", "evidenceProfile", "sourceHealthDependency", "requirementRef", "requirement"],
      "properties": {
        "id": { "type": "string", "pattern": "^(site|campus)\\.[a-z0-9-]+(\\.[a-z0-9-]+)+$", "description": "Requirement id, dotted, unique per row (e.g. campus.hero.header-overlap)." },
        "observerCheck": { "type": "string", "pattern": "^[a-z0-9]+(-[a-z0-9]+)+$", "description": "The aeo check name that measures this row. One check may feed several rows (viewports, conditions)." },
        "title": { "type": "string" },
        "pageFamily": { "type": "string", "description": "A key of the bundle's pageFamilies." },
        "lifecycleStates": { "type": "array", "items": { "type": "string", "enum": ["Open", "Announced", "Pre-Announcement"] }, "description": "Campus states the row applies to; empty when the row is not lifecycle-bound." },
        "element": { "type": "string", "description": "spec/campus-page-field-map.json element key, or a page-level pseudo-element (page.*, head.*, map.*, event.*, observer.*, robots.txt, sitemap, llms.txt, locations.directory)." },
        "viewports": { "type": "array", "items": { "type": "string", "enum": ["desktop", "mobile"] }, "description": "Rendered rows only: which viewports the row is measured on (desktop 1440x1000, mobile 390x844)." },
        "when": { "type": "string", "description": "Condition that selects this row among rows sharing an observerCheck." },
        "expected": {
          "type": "object",
          "description": "Either { literal } or { derive: { source, field, transform } }.",
          "properties": {
            "literal": {},
            "derive": {
              "type": "object",
              "required": ["source", "field", "transform"],
              "properties": {
                "source": { "type": "string", "description": "A sourceHealth id, or 'registry' for a playbook spec or registry file named in field." },
                "field": { "oneOf": [{ "type": "string" }, { "type": "array", "items": { "type": "string" } }] },
                "transform": { "type": "string" },
                "neverFields": { "type": "array", "items": { "type": "string" } },
                "neverFieldsReason": { "type": "string" }
              }
            }
          }
        },
        "comparator": {
          "type": "object",
          "required": ["type", "threshold", "unit"],
          "properties": {
            "type": { "type": "string", "enum": ["equals", "equals-url", "equals-approved-media", "contains", "not-contains", "starts-with", "intersects", "present", "absent-after-date", "not-placeholder", "campus-identity-match", "only-this-campus", "in-set", "host-in-set", "count-equals", "count-min", "count-max", "max", "distance-max", "age-max", "ratio-max", "coverage-min", "box-overlap-max", "http-2xx", "http-2xx-after-redirects", "http-2xx-rendered", "http-status", "valid-json", "valid-dates", "start-before-end"] },
            "threshold": { "type": "number" },
            "unit": { "type": "string" },
            "orThreshold": { "type": "number" },
            "orUnit": { "type": "string" },
            "detectAbove": { "type": "number", "description": "Below the filing threshold the observer still records the measurement above this value as telemetry." },
            "detectUnit": { "type": "string" },
            "maxSideCut": { "type": "number" },
            "minBytes": { "type": "number" },
            "gate": { "type": "string" },
            "note": { "type": "string" }
          },
          "additionalProperties": true
        },
        "severity": { "type": "string", "enum": ["critical", "high", "medium", "low"] },
        "status": { "type": "string", "enum": ["enforced", "advisory"], "description": "enforced rows dispatch tickets; advisory rows are measured and reported, never filed." },
        "channel": { "type": "string", "enum": ["ticket", "loop-health"], "description": "loop-health rows go to the observer owner and suppress the rows they name; they never enter the website queue." },
        "ticketClass": { "type": "string", "description": "A class id from spec/ticket-classes.json." },
        "ownerRole": { "type": "string", "description": "The intake owner role for the ticket class (spec/intake-policy.json), or the row's override." },
        "dedupeScope": { "type": "string", "enum": ["page", "template", "program", "event", "site"] },
        "clearAfterRuns": { "type": "number", "minimum": 1, "description": "Runs the check must clear before the filer resolves the ticket (default 2)." },
        "gracePeriodHours": { "type": "number", "minimum": 0, "description": "Hours after the source change before a finding may file (default 0)." },
        "requireConsecutiveRuns": { "type": "number", "minimum": 1, "description": "Consecutive failing runs before a finding may file (default 1; 2 for timeouts)." },
        "evidenceProfile": { "type": "array", "items": { "type": "string" } },
        "sourceHealthDependency": { "type": "array", "items": { "type": "string" }, "description": "sourceHealth ids; an unhealthy source suppresses the row's findings." },
        "suppressWhen": { "type": "array", "items": { "type": "string", "enum": ["event-ended", "hidden-on-all-viewports", "every-image-failed-in-run"] } },
        "suppresses": { "type": "string", "description": "loop-health rows: which rows are suppressed while this finding is open." },
        "exemptionsRef": { "type": "string", "description": "Registry file the observer must read for named exceptions." },
        "exemptions": { "type": "array", "items": { "type": "string" } },
        "decisionPending": { "type": "string", "description": "APEX ticket id of the decision that can change this row; the row carries the recommended value until then." },
        "note": { "type": "string" },
        "requirementRef": {
          "type": "object",
          "required": ["file", "key"],
          "properties": {
            "file": { "type": "string" },
            "key": { "type": "string", "description": "Slash-separated path inside the file, e.g. rules/site.layout.viewport or states/Open/campus.hero.identity." }
          }
        },
        "requirement": { "type": "string", "description": "Coarse requirement id from spec/observer-check-map.json for the observerCheck." }
      }
    },
    "retired": {
      "type": "object",
      "required": ["observerCheck", "reason", "replacedBy", "decidedBy", "date"],
      "properties": {
        "observerCheck": { "type": "string", "pattern": "^[a-z0-9]+(-[a-z0-9]+)+$" },
        "reason": { "type": "string" },
        "replacedBy": { "type": ["string", "null"], "description": "Row id that now covers the intent, or null." },
        "decidedBy": { "type": "string" },
        "date": { "type": "string", "pattern": "^20[0-9]{2}-[0-9]{2}-[0-9]{2}$" }
      }
    }
  }
}
