{
  "$comment": "Generated by tests/build-checks.mjs from spec/check-rows.json and the playbook specs and registries; do not edit by hand. Consumers: the production observer (superbuilders/aeo alpha-site-system), agent/file-observer-findings.mjs, tests/check-release.mjs. Schema: spec/schemas/check-bundle.schema.json.",
  "version": "1.0",
  "builtAt": "2026-09-24T18:18:52.316Z",
  "playbookCommit": "fb58e2a85e66cd2a946efdf9e4060a5207e42571",
  "policySha256": "d933cafdd40d4ee4f01d0ef53b330e68879f85a6179867651bfbf18f7d1a1fcd",
  "observerInventory": {
    "version": "2026-09-24",
    "commit": "cca5ac6718ab7e2306cf5e821f8cf51a5fa33bd5",
    "count": 109
  },
  "pageFamilies": {
    "homepage": [
      "homepage"
    ],
    "locations": [
      "locations"
    ],
    "campus-open": [
      "campus-open"
    ],
    "campus-announced": [
      "campus-announced"
    ],
    "campus-pre-announcement": [
      "campus-pre-announcement"
    ],
    "admissions-forms-applications": [
      "admissions-forms-applications"
    ],
    "alpha-answers": [
      "alpha-answers"
    ],
    "editorial": [
      "editorial"
    ],
    "events": [
      "events"
    ],
    "legal": [
      "legal"
    ],
    "campaign": [
      "campaign"
    ],
    "review-sandbox-confirmation": [
      "review-sandbox-confirmation"
    ],
    "global-template": [
      "global-template"
    ],
    "program": [
      "program"
    ],
    "reference": [
      "reference"
    ],
    "careers": [
      "careers"
    ],
    "author": [
      "author"
    ],
    "video-resource": [
      "video-resource"
    ],
    "campus-local-seo-post": [
      "campus-local-seo-post"
    ],
    "podcast-press-landing": [
      "podcast-press-landing"
    ],
    "campus": [
      "campus-open",
      "campus-announced"
    ],
    "map-routes": [
      "homepage",
      "locations"
    ],
    "critical-routes": [
      "homepage",
      "program",
      "locations",
      "admissions-forms-applications",
      "events"
    ],
    "map-source": "growth map API records (the HubSpot Programs mirror) and Operations sheet rows; not a page",
    "site": "every public route"
  },
  "sourceHealth": {
    "hubspot-programs": {
      "providerEntity": "hubspot-programs",
      "registryKey": "hubspotPrograms"
    },
    "growth-map-api": {
      "providerEntity": "map-api",
      "registryKey": "growthMapApi"
    },
    "operations-sheet": {
      "providerEntity": "campus-operations",
      "registryKey": "operationsSheet",
      "staleAfterHours": 168
    },
    "hubspot-events": {
      "providerEntity": "hubspot-events",
      "registryKey": "hubspotEvents"
    },
    "wordpress-rest": {
      "providerEntity": "wordpress-pages",
      "registryKey": "wordpress"
    },
    "wordpress-events": {
      "providerEntity": "wordpress-events",
      "registryKey": "hubspotEvents"
    },
    "campus-staff-roster": {
      "providerEntity": "campus-staff",
      "registryKey": "staffRoster"
    },
    "campus-packets-registry": {
      "providerEntity": null,
      "registryKey": "infoPackets"
    },
    "community-app": {
      "providerEntity": null,
      "registryKey": "communityApp"
    },
    "browser": {
      "providerEntity": null,
      "registryKey": null,
      "note": "a degraded browser session is reported by the loop-health rows below (route inspection, embed inspection, map inspection, every image failed)"
    }
  },
  "rows": [
    {
      "id": "campus.hero.identity.heading",
      "observerCheck": "campus-heading-identity",
      "title": "Page title or main headings name this campus",
      "pageFamily": "campus",
      "lifecycleStates": [
        "Open",
        "Announced"
      ],
      "element": "hero.title",
      "expected": {
        "derive": {
          "source": "hubspot-programs",
          "field": "school_without_school_keyword",
          "transform": "campus-name-appears-in-title-or-h1-h2"
        }
      },
      "comparator": {
        "type": "contains",
        "threshold": 1,
        "unit": "match"
      },
      "severity": "medium",
      "status": "enforced",
      "channel": "ticket",
      "ticketClass": "observer-brand-leak",
      "ownerRole": "website-agent-operator",
      "dedupeScope": "page",
      "clearAfterRuns": 2,
      "gracePeriodHours": 0,
      "requireConsecutiveRuns": 1,
      "evidenceProfile": [
        "mcp-receipt",
        "rendered-controls-json-or-screenshots-desktop-mobile",
        "page-check-json",
        "verify-public-page"
      ],
      "sourceHealthDependency": [
        "hubspot-programs"
      ],
      "requirementRef": {
        "file": "spec/campus-page-requirements.json",
        "key": "states/Open/campus.hero.identity"
      },
      "requirement": "campus.hero.identity"
    },
    {
      "id": "site.identity.sister-brand",
      "observerCheck": "campus-sister-brand-leak",
      "title": "No sister-brand name in page-owned content",
      "pageFamily": "campus",
      "lifecycleStates": [
        "Open",
        "Announced"
      ],
      "element": "page.text",
      "expected": {
        "derive": {
          "source": "registry",
          "field": "registry/sister-brand-exceptions.json brands[].pattern",
          "transform": "none-of-the-patterns-match-page-owned-text"
        }
      },
      "comparator": {
        "type": "not-contains",
        "threshold": 0,
        "unit": "matches"
      },
      "severity": "high",
      "status": "enforced",
      "channel": "ticket",
      "ticketClass": "observer-brand-leak",
      "ownerRole": "website-agent-operator",
      "dedupeScope": "page",
      "clearAfterRuns": 2,
      "gracePeriodHours": 0,
      "requireConsecutiveRuns": 1,
      "evidenceProfile": [
        "mcp-receipt",
        "rendered-controls-json-or-screenshots-desktop-mobile",
        "page-check-json",
        "verify-public-page"
      ],
      "sourceHealthDependency": [],
      "exemptionsRef": "registry/sister-brand-exceptions.json",
      "exemptions": [
        "allowed phrases per campus",
        "properNouns",
        "shared header, footer and navigation",
        "HubSpot-fed event cards (venue names)"
      ],
      "requirementRef": {
        "file": "spec/site-rules.json",
        "key": "rules/site.identity.sister-brand"
      },
      "requirement": "site.identity.sister-brand"
    },
    {
      "id": "site.identity.other-campus.images",
      "observerCheck": "campus-image-identity-conflict",
      "title": "No other campus in image file names, alt text or nearby text",
      "pageFamily": "campus",
      "lifecycleStates": [
        "Open",
        "Announced"
      ],
      "element": "gallery.images",
      "expected": {
        "literal": "no other known Alpha campus named in src, alt or nearby text of a visible image"
      },
      "comparator": {
        "type": "not-contains",
        "threshold": 0,
        "unit": "matches"
      },
      "severity": "high",
      "status": "enforced",
      "channel": "ticket",
      "ticketClass": "observer-media-identity",
      "ownerRole": "website-agent-operator",
      "dedupeScope": "page",
      "clearAfterRuns": 2,
      "gracePeriodHours": 0,
      "requireConsecutiveRuns": 1,
      "evidenceProfile": [
        "mcp-receipt",
        "rendered-controls-json-or-screenshots-desktop-mobile",
        "page-check-json",
        "verify-public-page"
      ],
      "sourceHealthDependency": [],
      "suppressWhen": [
        "hidden-on-all-viewports"
      ],
      "requirementRef": {
        "file": "spec/site-rules.json",
        "key": "rules/site.identity.other-campus"
      },
      "requirement": "site.identity.other-campus"
    },
    {
      "id": "site.seasonal.window",
      "observerCheck": "campus-expired-seasonal-cta",
      "title": "No seasonal CTA or copy after its window closes",
      "pageFamily": "campus",
      "lifecycleStates": [
        "Open",
        "Announced"
      ],
      "element": "page.text",
      "expected": {
        "literal": {
          "rules": [
            {
              "id": "summer-2026",
              "label": "Summer 2026 CTA",
              "expiresAfter": "2026-08-15T00:00:00.000-05:00",
              "patterns": [
                "\\bsummer\\s+registration\\b",
                "\\bsummer\\s+programs?\\b",
                "\\bsummer\\s+camps?\\b"
              ]
            }
          ]
        }
      },
      "comparator": {
        "type": "absent-after-date",
        "threshold": 0,
        "unit": "matches"
      },
      "severity": "medium",
      "status": "enforced",
      "channel": "ticket",
      "ticketClass": "observer-launch-copy",
      "ownerRole": "website-agent-operator",
      "dedupeScope": "page",
      "clearAfterRuns": 2,
      "gracePeriodHours": 0,
      "requireConsecutiveRuns": 1,
      "evidenceProfile": [
        "mcp-receipt",
        "rendered-controls-json-or-screenshots-desktop-mobile",
        "page-check-json",
        "verify-public-page"
      ],
      "sourceHealthDependency": [],
      "requirementRef": {
        "file": "spec/site-rules.json",
        "key": "rules/site.seasonal.window"
      },
      "requirement": "site.seasonal.window"
    },
    {
      "id": "campus.intro.media.current",
      "observerCheck": "campus-page-stale-launch-media",
      "title": "Open campus intro slot shows the approved open-state media, never launch-era media",
      "pageFamily": "campus",
      "lifecycleStates": [
        "Open"
      ],
      "element": "intro.media",
      "expected": {
        "derive": {
          "source": "registry",
          "field": "registry/campus-open-media.json campuses[slug].openMedia",
          "transform": "approved-card-or-video; null means ask the owner"
        }
      },
      "comparator": {
        "type": "equals-approved-media",
        "threshold": 0,
        "unit": "stale-signals"
      },
      "severity": "high",
      "status": "enforced",
      "channel": "ticket",